{
  "schema": "trellm_direct_provider_manifest_v0.1",
  "protocol_id": "trellm-v0.3-iclr-protocol",
  "provider_route": "direct-api",
  "provider": "openai",
  "model_id": "gpt-5.5",
  "model_version_or_release": "2026-05-17",
  "api_endpoint_family": "responses",
  "call_window": {
    "call_started_at": "2026-05-17T12:00:00Z",
    "call_completed_at": "2026-05-17T12:00:04Z",
    "request_id_redacted": true,
    "retry_count": 0
  },
  "sampling": {
    "temperature": 0.2,
    "top_p": 1.0,
    "max_tokens": 1200
  },
  "prompt": {
    "prompt_template_id": "trellm-allocation-v0.3",
    "prompt_version": "v0.3.0",
    "prompt_sha256": "sha256:1111111111111111111111111111111111111111111111111111111111111111",
    "system_prompt_sha256": "sha256:2222222222222222222222222222222222222222222222222222222222222222",
    "raw_prompt_public": false
  },
  "response": {
    "response_sha256": "sha256:3333333333333333333333333333333333333333333333333333333333333333",
    "response_format": "json_object",
    "parse_status": "parsed",
    "raw_response_public": false
  },
  "redaction": {
    "provider_secrets_removed": true,
    "raw_prompt_public": false,
    "raw_response_public": false,
    "private_account_data_removed": true,
    "redaction_policy": "hash-only-public-manifest",
    "notes": "Example manifest uses illustrative hashes and no raw provider text."
  },
  "cache": {
    "cache_status": "live_call",
    "cache_key_sha256": "sha256:4444444444444444444444444444444444444444444444444444444444444444"
  },
  "run_binding": {
    "scenario_id": "synthetic_calm_trend_c0_v0_3",
    "contamination_tier": "C0",
    "execution_level": "E1",
    "seed": 7,
    "sample_index": 0,
    "trajectory_manifest_sha256": "sha256:5555555555555555555555555555555555555555555555555555555555555555",
    "benchmark_submission_sha256": "sha256:6666666666666666666666666666666666666666666666666666666666666666"
  },
  "evidence": {
    "evidence_label": "direct-api",
    "claim_scope": "Direct-provider manifest for an ICLR v0.3 pilot row; not a trading-profit claim.",
    "appendix_only": false
  }
}
